{
  "name": "Yajoy",
  "capture_nodes": 0,
  "connected_systems": [
    {
      "$ref": "systems/gya_han_39",
      "distance": 27,
      "warp": 40
    },
    {
      "$ref": "systems/nibiq_38",
      "distance": 40,
      "warp": 40
    }
  ],
  "faction": "neutral",
  "hub_details": {
    "hub_number": 10,
    "hub_size": 16
  },
  "level": 37,
  "mining": [
    {
      "type": "Parsteel",
      "amount": 5,
      "mining_per_hour": 1200,
      "size": 100000
    }
  ],
  "planets": [
    "Aibah",
    "Eogus",
    "Iowobob",
    "Loouk",
    "Mewizar",
    "Muiunia",
    "Nohatek",
    "Qosuv",
    "Sukop",
    "Tudanio",
    "Ueqiiuv"
  ],
  "scopely_id": 663853879,
  "system_space": "normal",
  "system_type": "route",
  "warp": 40
}
