{
  "name": "Bilge",
  "capture_nodes": 0,
  "connected_systems": [
    {
      "$ref": "systems/warren_55",
      "distance": 320,
      "warp": 320
    },
    {
      "$ref": "systems/clara_53",
      "distance": 285,
      "warp": 255
    }
  ],
  "faction": "federation",
  "level": 54,
  "mining": [
    {
      "type": "5\u2605 Raw Gas",
      "amount": 12,
      "grade": 5,
      "mining_per_hour": 150,
      "size": 1700000
    }
  ],
  "planets": [
    "Calus",
    "Cebidip",
    "Pujap"
  ],
  "scopely_id": 129791609,
  "system_space": "deep",
  "system_type": "route",
  "warp": 285
}
