{
  "name": "Kre'Tak",
  "capture_nodes": 0,
  "connected_systems": [
    {
      "$ref": "systems/pktha_38",
      "distance": 47,
      "warp": 52
    }
  ],
  "faction": "neutral",
  "hub_details": {
    "hub_number": 10,
    "hub_size": 16
  },
  "level": 38,
  "mining": [
    {
      "type": "Parsteel",
      "amount": 5,
      "mining_per_hour": 1200,
      "size": 125000
    },
    {
      "type": "Tritanium",
      "amount": 5,
      "mining_per_hour": 320,
      "size": 45000
    }
  ],
  "planets": [
    "Eiqifif",
    "Eoiiy",
    "Iaaub",
    "Lusahab",
    "Mibif",
    "Niiaj",
    "Nomuuuk",
    "Ovaa",
    "Porofia",
    "Qojetim",
    "Waheh"
  ],
  "scopely_id": 1857228856,
  "system_space": "normal",
  "system_type": "terminal",
  "warp": 52
}
