{
  "name": "Khazara",
  "capture_nodes": 0,
  "connected_systems": [
    {
      "$ref": "systems/ophiuchi_39",
      "distance": 45,
      "warp": 45
    },
    {
      "$ref": "systems/chaltok_39",
      "distance": 40,
      "warp": 39
    }
  ],
  "faction": "romulan",
  "level": 39,
  "mining": [],
  "planets": [
    "Accipiter",
    "Foeen",
    "Yolufos"
  ],
  "scopely_id": 826167991,
  "system_space": "normal",
  "system_type": "route",
  "warp": 40
}
