{
  "name": "Jaq",
  "capture_nodes": 0,
  "connected_systems": [
    {
      "$ref": "systems/kaisu_33"
    }
  ],
  "faction": "romulan",
  "hub_details": {
    "hub_number": 14,
    "hub_size": 16
  },
  "level": 30,
  "mining": [
    {
      "type": "parsteel",
      "amount": 16,
      "mining_per_hour": 1200,
      "size": 76880
    }
  ],
  "planets": [
    "Casatev",
    "Cisoo",
    "Dedun",
    "Gonexuf",
    "Haguk",
    "Jawao",
    "Oidig",
    "Paain",
    "Purik",
    "Radap",
    "Sifek",
    "Tasuu",
    "Teiae",
    "Tibirim",
    "Yazat",
    "Zieef"
  ],
  "scopely_id": 44494918,
  "system_space": "normal",
  "system_type": "terminal",
  "warp": 26
}
