{
  "name": "Aetisan",
  "capture_nodes": 0,
  "connected_systems": [
    {
      "$ref": "systems/agrico_1"
    },
    {
      "$ref": "systems/bridford_4"
    },
    {
      "$ref": "systems/entrunar_1"
    },
    {
      "$ref": "systems/odal_1"
    }
  ],
  "faction": "neutral",
  "hub_details": {
    "hub_number": 10,
    "hub_size": 10
  },
  "level": 2,
  "mining": [
    {
      "type": "parsteel",
      "amount": 16,
      "mining_per_hour": 1200,
      "size": 1000
    }
  ],
  "planets": [
    "Cinof",
    "Daruo",
    "Eayazih",
    "Febax",
    "Hogakax",
    "Jurapik",
    "Kieiu",
    "Pieekar",
    "Qunegel",
    "Vujajoo",
    "Yekoh",
    "Yuhei",
    "Zuoohev",
    "Zuxamud"
  ],
  "scopely_id": 78968,
  "system_space": "normal",
  "system_type": "hub",
  "warp": 5
}
