{
  "name": "Le'Onor",
  "capture_nodes": 0,
  "connected_systems": [
    {
      "$ref": "systems/gemet_25",
      "distance": 8,
      "warp": 18
    }
  ],
  "faction": "federation",
  "hub_details": {
    "hub_number": 10,
    "hub_size": 16
  },
  "level": 21,
  "mining": [
    {
      "type": "Parsteel",
      "amount": 12,
      "mining_per_hour": 1200,
      "size": 40000
    }
  ],
  "planets": [
    "Ceuul",
    "Iueot",
    "Pedimid",
    "Pihuqen",
    "Qujaxet",
    "Qunahuh",
    "Sorosoh",
    "Uepun",
    "Vovihop",
    "Wetii",
    "Xohoo"
  ],
  "scopely_id": 1058489736,
  "system_space": "normal",
  "system_type": "terminal",
  "warp": 18
}
