{
  "name": "Dalfa",
  "capture_nodes": 0,
  "connected_systems": [
    {
      "$ref": "systems/benzi_4"
    },
    {
      "$ref": "systems/bo_jeems_1"
    },
    {
      "$ref": "systems/tohvus_1"
    },
    {
      "$ref": "systems/zanti_1"
    }
  ],
  "faction": "neutral",
  "hub_details": {
    "hub_number": 10,
    "hub_size": 10
  },
  "level": 2,
  "mining": [
    {
      "type": "parsteel",
      "amount": 16,
      "mining_per_hour": 1200,
      "size": 1000
    }
  ],
  "planets": [
    "Ainec",
    "Eifoyuw",
    "Eiluc",
    "Eotih",
    "Iohon",
    "Lukixef",
    "Mafep",
    "Morr",
    "Paviwex",
    "Qurepil",
    "Suxel"
  ],
  "scopely_id": 72084,
  "system_space": "normal",
  "system_type": "hub",
  "warp": 5
}
