{
  "name": "Loaiy",
  "capture_nodes": 0,
  "connected_systems": [
    {
      "$ref": "systems/enthra_27",
      "distance": 8,
      "warp": 19
    }
  ],
  "faction": "klingon",
  "hub_details": {
    "hub_number": 10,
    "hub_size": 16
  },
  "level": 25,
  "mining": [
    {
      "type": "Tritanium",
      "amount": 25,
      "mining_per_hour": 320,
      "size": 18000
    }
  ],
  "planets": [
    "Eurew",
    "Feyug",
    "Hofok",
    "Jueavax",
    "Kebag",
    "Lemuquk",
    "Naraq",
    "Natud",
    "Qowux",
    "Solal",
    "Yimak"
  ],
  "scopely_id": 355503878,
  "system_space": "normal",
  "system_type": "terminal",
  "warp": 19
}
