{
  "name": "Bildari",
  "capture_nodes": 0,
  "connected_systems": [
    {
      "$ref": "systems/elaisik_38",
      "distance": 95,
      "warp": 39
    },
    {
      "$ref": "systems/saetel_46",
      "distance": 120,
      "warp": 120
    },
    {
      "$ref": "systems/velnor_42",
      "distance": 95,
      "warp": 70
    }
  ],
  "faction": "romulan",
  "level": 44,
  "mining": [],
  "planets": [],
  "scopely_id": 835707420,
  "system_space": "normal",
  "system_type": "hub",
  "warp": 95
}
