{
  "name": "Sahqooq",
  "capture_nodes": 0,
  "connected_systems": [
    {
      "$ref": "systems/aiti_33",
      "distance": 16,
      "warp": 26
    }
  ],
  "faction": "federation",
  "hub_details": {
    "hub_number": 14,
    "hub_size": 16
  },
  "level": 30,
  "mining": [
    {
      "type": "Dilithium",
      "amount": 16,
      "mining_per_hour": 80,
      "size": 8000
    }
  ],
  "planets": [
    "Augee",
    "Daeuvus",
    "Eiiibov",
    "Fezug",
    "Gidokuj",
    "Gilub",
    "Loaur",
    "Pusimut",
    "Rimio",
    "Rofajes",
    "Tidon",
    "Totihau",
    "Uebokib",
    "Wuceeiy",
    "Yofazec",
    "Zilaeid"
  ],
  "scopely_id": 797035141,
  "system_space": "normal",
  "system_type": "terminal",
  "warp": 26
}
