{
  "name": "Bo-Jeems",
  "capture_nodes": 0,
  "connected_systems": [
    {
      "$ref": "systems/dalfa_2"
    }
  ],
  "faction": "neutral",
  "hub_details": {
    "hub_number": 10,
    "hub_size": 16
  },
  "level": 1,
  "mining": [],
  "planets": [
    "Bexak",
    "Dutobos",
    "Eoaicao",
    "Guaiden",
    "Iabub",
    "Jaioo",
    "Jezzi",
    "Lisot",
    "Maseq",
    "Naieooy",
    "Oemetiy",
    "Pexep",
    "Uodav",
    "Wugapur"
  ],
  "scopely_id": 71907,
  "system_space": "normal",
  "system_type": "terminal",
  "warp": 5
}
