{
  "name": "Anzat Alpha",
  "capture_nodes": 7,
  "connected_systems": [
    {
      "$ref": "systems/tholus_gamma_40",
      "distance": 5,
      "warp": 20
    },
    {
      "$ref": "systems/parturi_beta_20",
      "distance": 5,
      "warp": 20
    },
    {
      "$ref": "systems/anzat_beta_30",
      "distance": 5,
      "warp": 20
    }
  ],
  "faction": "neutral",
  "hub_details": {
    "hub_number": 4,
    "hub_size": 6
  },
  "level": 30,
  "mining": [
    {
      "type": "3\u2605 Raw Crystal",
      "amount": 20,
      "grade": 3,
      "mining_per_hour": 450,
      "size": 30000
    }
  ],
  "planets": [
    "Temmerat",
    "Terra Anzat",
    "Thoras",
    "Tusa"
  ],
  "scopely_id": 1832830529,
  "system_space": "origin",
  "system_type": "hub",
  "warp": 20
}
