{
  "name": "Seevor",
  "capture_nodes": 0,
  "connected_systems": [
    {
      "$ref": "systems/krah_hor_18"
    },
    {
      "$ref": "systems/krlakh_28"
    }
  ],
  "faction": "neutral",
  "level": 28,
  "mining": [],
  "planets": [
    "Ioji",
    "Taras"
  ],
  "scopely_id": 1241010127,
  "system_space": "normal",
  "system_type": "route",
  "warp": 20
}
