{
  "name": "Kayojui",
  "capture_nodes": 0,
  "connected_systems": [
    {
      "$ref": "systems/friefra_10"
    }
  ],
  "faction": "neutral",
  "hub_details": {
    "hub_number": 10,
    "hub_size": 16
  },
  "level": 9,
  "mining": [
    {
      "type": "parsteel",
      "amount": 25,
      "mining_per_hour": 1200,
      "size": 15000
    }
  ],
  "planets": [
    "Bigip",
    "Celaeeg",
    "Doousap",
    "Leoorac",
    "Nilegas",
    "Oapeieh",
    "Ouzit",
    "Surof",
    "Uoyim",
    "Vebie",
    "Vukimah"
  ],
  "scopely_id": 451252032,
  "system_space": "normal",
  "system_type": "terminal",
  "warp": 8
}
