{
  "name": "Mari",
  "capture_nodes": 0,
  "connected_systems": [
    {
      "$ref": "systems/imgra_10",
      "distance": 3,
      "warp": 5
    }
  ],
  "faction": "neutral",
  "hub_details": {
    "hub_number": 10,
    "hub_size": 16
  },
  "level": 9,
  "mining": [
    {
      "type": "Parsteel",
      "amount": 50,
      "mining_per_hour": 1200,
      "size": 15000
    }
  ],
  "planets": [
    "Bamedup",
    "Behoc",
    "Cigiwat",
    "Ouharal",
    "Reber",
    "Rekiqox",
    "Rulujoa",
    "Ruyozer",
    "Voxigip",
    "Yidenas",
    "Zacev"
  ],
  "scopely_id": 81593,
  "system_space": "normal",
  "system_type": "terminal",
  "warp": 5
}
