{
  "name": "Holles",
  "capture_nodes": 0,
  "connected_systems": [
    {
      "$ref": "systems/almango_43"
    },
    {
      "$ref": "systems/hyland_42"
    },
    {
      "$ref": "systems/kildare_43"
    },
    {
      "$ref": "systems/luoman_41"
    },
    {
      "$ref": "systems/new_calgary_43"
    },
    {
      "$ref": "systems/new_canberra_44"
    },
    {
      "$ref": "systems/rua_ri_42"
    }
  ],
  "faction": "federation",
  "level": 43,
  "mining": [
    {
      "type": "gas",
      "amount": 12,
      "grade": 4,
      "mining_per_hour": 300,
      "size": 89076
    }
  ],
  "planets": [
    "Starbase 87"
  ],
  "scopely_id": 1702244411,
  "system_space": "deep",
  "system_type": "hub",
  "warp": 75
}
