{
  "name": "Benes Delta",
  "capture_nodes": 0,
  "connected_systems": [
    {
      "$ref": "systems/pasadoran_26",
      "distance": 18,
      "warp": 18
    }
  ],
  "faction": "neutral",
  "level": 27,
  "mining": [],
  "planets": [
    "Dahlman",
    "Koalar",
    "Olltala",
    "Pear"
  ],
  "scopely_id": 2124972704,
  "system_space": "normal",
  "system_type": "terminal",
  "token_info": {
    "type": "item",
    "token_amount": 1,
    "token_type": "Transwarp Cell"
  },
  "token_needed": true,
  "warp": 18
}
