{
  "name": "HSP-G",
  "capture_nodes": 0,
  "connected_systems": [
    {
      "$ref": "systems/pneuma_40",
      "warp": 70
    },
    {
      "$ref": "systems/rowla_40",
      "warp": 1
    }
  ],
  "faction": "neutral",
  "level": 40,
  "mining": [],
  "scopely_id": 1141745487,
  "system_space": "deep",
  "system_type": "route",
  "warp": 64
}
