{
  "name": "Jeuaiei",
  "capture_nodes": 0,
  "connected_systems": [
    {
      "$ref": "systems/vendus_a_27"
    }
  ],
  "faction": "romulan",
  "hub_details": {
    "hub_number": 10,
    "hub_size": 16
  },
  "level": 25,
  "mining": [
    {
      "type": "parsteel",
      "amount": 25,
      "mining_per_hour": 1200,
      "size": 60000
    }
  ],
  "planets": [
    "Audonuf",
    "Bauuk",
    "Fipelih",
    "Gexufak",
    "Iifok",
    "Juoek",
    "Kaeaw",
    "Mumaper",
    "Oimin",
    "Sewiaeb",
    "Vouukab"
  ],
  "scopely_id": 1556190441,
  "system_space": "normal",
  "system_type": "terminal",
  "warp": 19
}
