{
  "name": "Dela",
  "capture_nodes": 0,
  "connected_systems": [
    {
      "$ref": "systems/remme_50",
      "distance": 30,
      "warp": 185
    },
    {
      "$ref": "systems/farana_50",
      "distance": 30,
      "warp": 105
    },
    {
      "$ref": "systems/tej_lukk_50",
      "distance": 1,
      "warp": 185
    },
    {
      "$ref": "systems/belmont_51",
      "distance": 205,
      "warp": 205
    },
    {
      "$ref": "systems/ghuh_50",
      "distance": 185,
      "warp": 185
    }
  ],
  "faction": "neutral",
  "level": 51,
  "mining": [],
  "planets": [
    "Dayon-C",
    "Dela Prime",
    "Shelly"
  ],
  "scopely_id": 393023826,
  "system_space": "deep",
  "system_type": "hub",
  "warp": 185
}
