{
  "name": "Nelvana",
  "capture_nodes": 0,
  "connected_systems": [
    {
      "$ref": "systems/calder_39",
      "distance": 31,
      "warp": 31
    },
    {
      "$ref": "systems/azati_34",
      "distance": 25,
      "warp": 27
    },
    {
      "$ref": "systems/gradientes_30",
      "distance": 27,
      "warp": 24
    }
  ],
  "faction": "romulan",
  "level": 32,
  "mining": [
    {
      "type": "Dilithium",
      "amount": 5,
      "mining_per_hour": 80,
      "size": 8000
    }
  ],
  "planets": [
    "Nelvana I",
    "Nelvana II"
  ],
  "scopely_id": 37,
  "system_space": "normal",
  "system_type": "hub",
  "warp": 27
}
