{
  "name": "Saetel",
  "capture_nodes": 0,
  "connected_systems": [
    {
      "$ref": "systems/bildari_44",
      "distance": 120,
      "warp": 95
    },
    {
      "$ref": "systems/tulris_48",
      "distance": 150,
      "warp": 150
    }
  ],
  "faction": "romulan",
  "level": 46,
  "mining": [],
  "planets": [],
  "scopely_id": 1383541989,
  "system_space": "normal",
  "system_type": "route",
  "warp": 120
}
