{
  "name": "Kol Ran",
  "capture_nodes": 0,
  "connected_systems": [
    {
      "$ref": "systems/francihk_20",
      "distance": 15,
      "warp": 13
    },
    {
      "$ref": "systems/urthak_26",
      "distance": 16,
      "warp": 16
    }
  ],
  "faction": "klingon",
  "level": 22,
  "mining": [],
  "planets": [
    "Auoiq",
    "Feyaxev",
    "Iaiun",
    "Ionuqiy",
    "Koyir",
    "Yaoelel",
    "Yebiv",
    "Zafaeue"
  ],
  "scopely_id": 395344716,
  "system_space": "normal",
  "system_type": "route",
  "warp": 15
}
